{
  "command": "migrate schema-to-schema verify",
  "tables": {
    "users": {
      "source_count": 3,
      "target_count": 3,
      "match": true,
      "difference": 0
    },
    "posts": {
      "source_count": 2,
      "target_count": 2,
      "match": true,
      "difference": 0
    }
  },
  "matched": true,
  "ok": true,
  "parser": {
    "pglast": "8.4",
    "pg_major": 18
  }
}
